{
  "$schema": "./virksomhed.schema.json",
  "schemaVersion": 1,
  "configurationVersion": "2026-07-12.1",
  "status": "draft_requires_business_approval",
  "basedOnCatalogVersion": "2026-07-12.1",
  "company": {
    "id": "company-placeholder",
    "name": "UDFYLD VIRKSOMHEDSNAVN",
    "legalName": null,
    "cvr": null
  },
  "locations": [
    {
      "id": "primary-location",
      "name": "UDFYLD LOKATIONSNAVN",
      "timeZone": "Europe/Copenhagen",
      "active": true
    }
  ],
  "assets": [
    {
      "id": "refrigerator-1",
      "locationId": "primary-location",
      "type": "refrigerator",
      "label": "Køl 1 – omdøb eller fjern",
      "active": true,
      "temperatureProfileId": "chilled-general-draft",
      "status": "requires_review"
    },
    {
      "id": "freezer-1",
      "locationId": "primary-location",
      "type": "freezer",
      "label": "Frost 1 – omdøb eller fjern",
      "active": true,
      "temperatureProfileId": "deep-frozen-draft",
      "status": "requires_review"
    }
  ],
  "activitySelections": [
    { "activityId": "goods-receiving", "enabled": true, "status": "requires_review" },
    { "activityId": "cold-storage", "enabled": true, "status": "requires_review" },
    { "activityId": "frozen-storage", "enabled": true, "status": "requires_review" },
    { "activityId": "heat-treatment", "enabled": true, "status": "requires_review" },
    { "activityId": "cooling", "enabled": true, "status": "requires_review" },
    { "activityId": "hot-holding", "enabled": true, "status": "requires_review" }
  ],
  "controlOverrides": [
    {
      "controlId": "refrigeration-temperature",
      "locationId": "primary-location",
      "enabled": true,
      "status": "requires_review",
      "controlFrequency": { "kind": "daily", "localTime": "09:00" },
      "documentationFrequency": { "kind": "every_control", "deviationsAlways": true }
    },
    {
      "controlId": "freezer-temperature",
      "locationId": "primary-location",
      "enabled": true,
      "status": "requires_review",
      "controlFrequency": { "kind": "daily", "localTime": "09:00" },
      "documentationFrequency": { "kind": "every_control", "deviationsAlways": true }
    }
  ],
  "profileOverrides": [],
  "review": {
    "approvedAt": null,
    "approvedBy": null,
    "notes": "Udfyld virksomheds- og lokationsdata, gennemgå aktiviteter, registrér alt relevant udstyr, og godkend grænser og hyppigheder før status ændres.",
    "openQuestions": [
      "Hvad er virksomhedens navn og eventuelle CVR-nummer?",
      "Hvor mange lokationer skal systemet dække?",
      "Hvilke køle- og fryseenheder findes på hver lokation?",
      "Hvilke af de seks startaktiviteter udføres faktisk?",
      "Hvornår på driftsdagen er faste kontroller mest praktiske?",
      "Hvilke produktkategorier kræver særskilte temperaturprofiler?"
    ]
  }
}
